name,ring,quadrant,isNew,description 
Jacoco,adopt,tools,FALSE,"<p><a href=""http://https://www.baeldung.com/jacoco""><strong>JaCoCo</strong></a> is a free Java code coverage library distributed under the Eclipse Public License.</p>"
LocalStack,assess,tools,FALSE,"<p>One of the challenges of using cloud services is being able to develop and test locally. <strong><a href=""https://github.com/localstack/localstack"">LocalStack</a></strong> solves this problem for <a href=""/radar/platforms/aws"">AWS</a> by providing local <a href=""https://martinfowler.com/bliki/TestDouble.html"">test double</a> implementations of a wide range of AWS services, including S3, Kinesis, DynamoDB and Lambda. It builds on top of best-of-breed tools such as <a href=""https://github.com/mhart/kinesalite"">Kinesalite</a>, <a href=""https://github.com/mhart/dynalite"">dynalite</a> and <a href=""https://github.com/spulec/moto"">Moto</a> and adds isolated processes and error injection functionality. LocalStack is very easy to use, ships with a simple JUnit runner and a JUnit 5 extension and can also run inside a docker container. For many teams, it has become the default for testing services that are deployed on AWS.</p> "
Helm ,trial,tools,FALSE,"<p><a href=""http://helm.sh""><strong>Helm</strong></a> is a package manager for <a href=""/radar/platforms/kubernetes"">Kubernetes</a>. It comes with a repository of curated Kubernetes applications that are maintained in the official <a href=""https://github.com/helm/charts"">Charts repository</a>. Helm has two components: a command line utility called Helm and a cluster component called Tiller. Securing a Kubernetes cluster is a wide and nuanced topic, but we highly recommend setting up Tiller in a role-based access control (RBAC) environment. We've used Helm in a number of client projects and its dependency management, templating and hook mechanism has greatly simplified the application lifecycle management in Kubernetes. However, we recommend proceeding with caution ‚Äî Helm's <a href=""/radar/techniques/templating-in-yaml"">YAML templating</a> can be difficult to understand, and Tiller still has some rough edges. Helm 3 is expected to address these issues.</p> "
SoapUI,hold,tools,TRUE,"<p>SoapUI is an open-source web service testing application for service-oriented architectures (SOA) and representational state transfers (REST). Its functionality covers web service inspection, invoking, development, simulation and mocking, functional testing, load and compliance testing</p> "
JMeter,adopt,tools,FALSE,"<p>The Apache JMeter application is open source software, a 100% pure Java application designed to load test functional behavior and measure performance. Apache JMeter may be used to test performance both on static and dynamic resources, Web dynamic applications. It can be used to simulate a heavy load on a server, group of servers, network or object to test its strength or to analyze overall performance under different load types</p> "
AVA,trial,language-and-frameworks,FALSE,"<p><strong><a href=""https://github.com/avajs/ava"">AVA</a></strong> is a test runner for Node.js. Even though JavaScript is single-threaded, IO in Node.js can happen in parallel because of its asynchronous nature. AVA takes advantage of this and runs your tests concurrently, which is especially beneficial for IO-heavy tests. In addition, test files are run in parallel as separate processes, giving you even better performance and an isolated environment for each test file. AVA is a lightweight option, when compared to full-featured frameworks such as <a href=""/radar/languages-and-frameworks/jest"">Jest</a>. It is opinionated and forces you to write atomic test cases.</p> "
Terraform,hold,tools,FALSE,"<p><strong><a href=""https://www.terraform.io/"">Terraform</a></strong>, is rapidly becoming a de facto choice for creating and managing cloud infrastructures by writing declarative definitions. The configuration of the servers instantiated by Terraform is usually left to Puppet, Chef or Ansible. We like Terraform because the syntax of its files is quite readable and because it supports a number of cloud providers while making no attempt to provide an artificial abstraction across those providers. The active community will add support for the latest features from most cloud providers. Following our first, more cautious, mention of Terraform almost two years ago, it has seen continued development and has evolved into a stable product with a good ecosystem that has proven its value in our projects. The issue with state file management can now be sidestepped by using what Terraform calls a ""remote state backend."" We've successfully used <a href=""https://aws.amazon.com/s3/"">AWS S3</a> for that purpose.</p> "
Git,adopt,tools,FALSE,"<p>Git is a distributed version-control system for tracking changes in source code during software development. It is designed for coordinating work among programmers, but it can be used to track changes in any set of files. Its goals include speed, data integrity, and support for distributed, non-linear workflows</p> "
Postman,assess,tools,FALSE,"<p>Postman is an API(application programming interface) development tool which helps to build, test and modify APIs. It has the ability to make various types of HTTP requests(GET, POST, PUT, PATCH), saving environments for later use, converting the API to code for various languages(like JavaScript, Python). </p> "
Npm,adopt,tools,FALSE,"<p>npm (originally short for Node Package Manager) is a package manager for the JavaScript programming language. It is the default package manager for the JavaScript runtime environment Node.js. It consists of a command line client, also called npm, and an online database of public and paid-for private packages, called the npm registry. The registry is accessed via the client, and the available packages can be browsed and searched via the npm website</p> "
Gradle,adopt,tools,FALSE,<p>Gradle is an open-source build-automation system that builds upon the concepts of Apache Ant and Apache Maven and introduces a Groovy-based domain-specific language (DSL) instead of the XML form used by Apache Maven for declaring the project configuration</p> 
Chaos Toolkit,adopt,tools,FALSE,"<p> <b>Chaos toolkit</b> is a tool that orchestrates chaos engineering scenarios, this is achieved through drivers that expose functions that allow access to the system and its capabilities either to inject faults or to know your state. <b>This tool defined in Bancolombia</b></p>"
Serenity BDD,adopt,language-and-frameworks,TRUE,"<p><b>Serenity BDD</b> helps you write cleaner and more maintainable automated acceptance and regression tests faster. Serenity also uses the test results to produce illustrated, narrative reports that document and describe what your application does and how it works. Serenity tells you not only what tests have been executed, but more importantly, what requirements have been tested.</p> "
Protractor,hold,tools,TRUE,"<p>Protractor is an end-to-end test framework for Angular and AngularJS applications. Protractor runs tests against your application running in a real browser, interacting with it as a user would</p> "
Selenium,hold,tools,FALSE,"<p><b>Selenium</b> is an umbrella project for a range of tools and libraries that enable and support the automation of web browsers.</br>Selenium brings together browser vendors, engineers, and enthusiasts to further an open discussion around automation of the web platform. The project organises an annual conference to teach and nurture the community. <br>At the core of Selenium is <b>WebDriver</b>, an interface to write instruction sets that can be run interchangeably in many browsers</p> "
Jest,adopt,language-and-frameworks,FALSE,"<p><b>Jest</b> is a delightful JavaScript Testing Framework with a focus on simplicity. It works with projects using: Babel, TypeScript, Node, React, Angular, Vue and more!<br> Jest is a JavaScript testing framework designed to ensure correctness of any JavaScript codebase. It allows you to write tests with an approachable, familiar and feature-rich API that gives you results quickly. <br> Jest is well-documented, requires little configuration and can be extended to match your requirements. Jest makes testing delightful.</p> "
CloudFormation,adopt,platforms,FALSE,"<p><a href=""https://aws.amazon.com/cloudformation/"">AWS CloudFormation</a> provides a common language for you to describe and provision all the infrastructure resources in your cloud environment. CloudFormation allows you to use programming languages or a simple text file to model and provision, in an automated and secure manner, all the resources needed for your applications across all regions and accounts. This gives you a single source of truth for your AWS resources </p> "
AWS CDK ,adopt,language-and-frameworks,FALSE,"<p><b>AWS Cloud Development Kit (AWS CDK)</b> is a software development framework for defining cloud infrastructure in code and provisioning it through AWS CloudFormation. <br>The AWS CDK supports TypeScript, JavaScript, Python, Java, and C#/.Net. </p>"
NodeJs ,trial ,language-and-frameworks,FALSE,"<p><strong>Node.js</strong> is an open-source, cross-platform, JavaScript runtime environment that executes JavaScript code outside of a browser. Node.js lets developers use JavaScript to write command line tools and for server-side scripting‚Äîrunning scripts server-side to produce dynamic web page content before the page is sent to the user's web browser</p> "
TypeScript/Javascript,adopt,language-and-frameworks,FALSE,"<p><strong><a href=""https://www.typescriptlang.org/"">TypeScript</a></strong>, a statically typed language and superset of JavaScript, has become our sensible default. Large-scale projects benefit most from the type safety. Our developers favor its minimal configuration management, well-integrated IDE support and its ability to refactor code safely and gradually adopt types. With its <a href=""https://definitelytyped.org/"">good repository</a> of TypeScript-type definitions at hand, we benefit from all the rich JavaScript libraries while gaining type safety.</p> "
React.js,assess,language-and-frameworks,FALSE,<p><b>React.js</b> is a JavaScript library for building user interfaces. It's declarative and Component-based.</p>
RxJS,adopt,language-and-frameworks,FALSE,"<p><b>RxJS</b> is a library for composing asynchronous and event-based programs by using observable sequences. It provides one core type, the Observable, satellite types (Observer, Schedulers, Subjects) and operators inspired by Array#extras (map, filter, reduce, every, etc) to allow handling asynchronous events as collections.</p>"
RPG,assess,language-and-frameworks,FALSE,"<p><b>RPG</b> is a high-level fully procedural programming language used by businesses to create commercial business applications on IBM‚Äôs leading minicomputer system, the AS400 or iSeries. RPG has gained wide acceptance and has evolved massively since its inception. Today several ERP‚Äôs and mission critical business applications, are written in RPG based on RPG IV, because it is enabled to provide an interactive programming environment to AS400 RPG Programmers.</p>"
Cobol,hold,language-and-frameworks,FALSE,"<p><b>COBOL</b> is a programming language that is mainly focused on solving a business problem. Full form of COBOL is Common Business-Oriented Language. It is primarily used in company and government business, finance, and administrative systems. This language also used as a solution to many data processing problems.</p>"
Xamarin ,hold,platforms,FALSE,"<p>Xamarin extends the .NET platform with tools and libraries specifically for building apps on iOS, Android, macOS, and more.</p> "
Flutter,assess,platforms,FALSE,"<p><b>Flutter</b> is Google‚Äôs UI toolkit for building beautiful, natively compiled applications for mobile, web, and desktop from a single codebase. It has an Expressive and Flexible UI, it brings Native Performance and it allows a fast development by using a rich set of fully-customizable widgets. </p>"
AngularJs,hold,language-and-frameworks,FALSE,"<p><b>AngularJS</b> lets you extend HTML vocabulary for your application. The resulting environment is extraordinarily expressive, readable, and quick to develop.<br>AngularJS is a toolset for building the framework most suited to your application development. It is fully extensible and works well with other libraries. Every feature can be modified or replaced to suit your unique development workflow and feature needs. Read on to find out how. </p>"
Angular,adopt,language-and-frameworks,FALSE,"<p><b>Angular</b> is an application design framework and development platform for creating efficient and sophisticated single-page apps. Angular provides one way to build applications and reuse your code and abilities to build apps for any deployment target. For web, mobile web, native mobile and native desktop. </p>"
Java,adopt,language-and-frameworks,FALSE,"<p>Java is a general-purpose programming language that is class-based, object-oriented, and designed to have as few implementation dependencies as possible. It is intended to let application developers write once, run anywhere (WORA), meaning that compiled Java code can run on all platforms that support Java without the need for recompilation</p>"
Python,trial,language-and-frameworks,FALSE,"<p>Python is an interpreted, high-level, general-purpose programming language. Created by Guido van Rossum and first released in 1991, Python's design philosophy emphasizes code readability with its notable use of significant whitespace. Its language constructs and object-oriented approach aim to help programmers write clear, logical code for small and large-scale projects</p> "
Mockito,adopt,language-and-frameworks,FALSE,<p>Mockito is a mocking framework for java. It lets you write tests with a clean and simple API. Mockito doesn‚Äôt give you hangover because the tests are very readable and they produce clean verification errors</p> 
PowerMock,assess,language-and-frameworks,FALSE,"<p>PowerMock is a framework that extends other mock libraries such as EasyMock with more powerful capabilities. PowerMock uses a custom classloader and bytecode manipulation to enable mocking of static methods, constructors, final classes and methods, private methods, removal of static initializers and more<p> "
Elixir - Erlang/OTP,assess,language-and-frameworks,FALSE,"<p>Elixir is an alternative language for the Erlang virtual machine that allows you to write cleaner, more compact code that does a better job of revealing your intentions. You write programs in Elixir and run them normally in BEAM.<br> Elixir targets the Erlang runtime. The result of compiling the Elixir source code is BEAM-compliant bytecode files that can run in a BEAM instance and can normally cooperate with pure Erlang code ‚Äî you can use Erlang libraries from Elixir and vice versa. There‚Äôs nothing you can do in Erlang that can‚Äôt be done in Elixir, and usually the Elixir code is as performant as its Erlang counterpart.<br> Elixir provides constructs that make it possible to radically reduce boilerplate and duplication. <br> Elixir solution is usually easier to develop and maintain thanks to some nice syntactic sugar and a uniform tool for creating and packaging systems. </p>"
SuperTest ,assess,language-and-frameworks,FALSE,<p>Super-agent driven library for testing node.js HTTP servers using a fluent API</p> 
Spring Framework,adopt,language-and-frameworks,FALSE,"<p>The Spring Framework is an application framework and inversion of control container for the Java platform. The framework's core features can be used by any Java application, but there are extensions for building web applications on top of the Java EE (Enterprise Edition) platform.</p> "
Hibernate,assess,language-and-frameworks,FALSE,"<p>Hibernate ORM (Hibernate in short) is an object-relational mapping tool for the Java programming language. It provides a framework for mapping an object-oriented domain model to a relational database. Hibernate handles object-relational impedance mismatch problems by replacing direct, persistent database accesses with high-level object handling functions.</p> "
Spark Framework ,hold,language-and-frameworks,FALSE,"<p>Spark Framework is a simple and expressive Java/Kotlin web framework DSL built for rapid development. Sparks intention is to provide an alternative for Kotlin/Java developers that want to develop their web applications as expressive as possible and with minimal boilerplate. With a clear philosophy Spark is designed not only to make you more productive, but also to make your code better under the influence of Spark‚Äôs sleek, declarative and expressive syntax.</p> "
Reactor,assess,language-and-frameworks,FALSE,"<p>Alongside HTML and CSS, JavaScript is one of the core technologies of the World Wide Web. JavaScript enables interactive web pages and is an essential part of web applications. </p>"
Resilience4j,trial,language-and-frameworks,FALSE,"<p><a href=""https://github.com/resilience4j/resilience4j""><strong>Resilience4j</strong></a> is a lightweight fault tolerance library inspired by Netflix <a href=""/radar/tools/hystrix"">Hystrix</a>. We like its lightweight and modular structure where we pull in specific modules for specific capabilities such as circuit-breaking, rate-limiting, retry, and bulkhead. While <a href=""/radar/techniques/service-mesh"">service meshes</a> are taking on some of the fault tolerance capabilities, fault tolerance libraries continue to remain a key component of our systems for more nuanced domain-specific fault tolerance behavior and for non-containerized services. With Hystrix going into <a href=""https://github.com/Netflix/Hystrix/commit/a7df971cbaddd8c5e976b3cc5f14013fe6ad00e6#diff-04c6e90faac2675aa89e2176d2eec7d8"">maintenance mode</a>, Resilience4j becomes a default choice in the Java ecosystem. It can work with synchronous APIs as well as reactive ones. It also surfaces metrics to <a href=""https://metrics.dropwizard.io/4.0.0/"">dropwizard metrics</a>, <a href=""/radar/tools/prometheus"">Prometheus</a> and others using additional modules.</p> "
WebFlux,adopt,language-and-frameworks,FALSE,"<p><strong><a href=""https://docs.spring.io/spring/docs/current/spring-framework-reference/web-reactive.html"">WebFlux</a></strong> is the Spring Framework implementation of <a href=""https://www.reactive-streams.org/"">Reactive Streams</a>. We see a rise in reactive programming models across our teams in general and the use of WebFlux in teams who are working in the Spring ecosystem. It's best used in large microservices ecosystems where the high performance of the requests is a major concern. It allows overlapping request processing asynchronously without the complications of using multiple threads. WebFlux uses <a href=""https://github.com/reactor/reactor"">Reactor</a> as its reactive library but it is interoperable with other reactive libraries via Reactive Streams. It uses <a href=""https://netty.io/"">Netty</a> as its underlying high-performance communications engine. Although we encourage using Reactive Streams, adopting this programming model requires a significant shift in thinking.</p> "
React Native,hold,platforms,FALSE,"<p><b>React Native</b> is an open source platform for developing native mobile applications; it was developed largely by a team at Facebook. The cool part of working with React Native is that your program uses standard web technologies like JavaScript (JSX), CSS, and HTML, yet your application is fully native. In other words, your application is fast and smooth, and it is equivalent to any native application built using traditional iOS technologies like Objective-C and Swift. However, React Native does not compromise in terms of performance and overall experience, like popular hybrid frameworks that use web technologies to build iOS apps. </p>"
RDS - SQLServer,hold,platforms,FALSE,"<p>Amazon RDS is a distributed relational database service by Amazon Web Services (AWS). SQL Server is a relational database management system developed by Microsoft. Amazon RDS for SQL Server makes it easy to set up, operate, and scale SQL Server deployments in the cloud. With Amazon RDS, you can deploy multiple editions of SQL Server (2012, 2014, 2016, 2017 and 2019) including Express, Web, Standard and Enterprise, in minutes with cost-efficient and re-sizable compute capacity. Amazon RDS frees you up to focus on application development by managing time-consuming database administration tasks including provisioning, backups, software patching, monitoring, and hardware scaling</p> "
RDS - Oracle,hold,platforms,FALSE,"<p>Amazon RDS for Oracle is a fully managed commercial database that makes it easy to set up, operate, and scale Oracle deployments in the cloud. Amazon RDS frees you up to focus on innovation and application development by managing time-consuming database administration tasks including provisioning, backups, software patching, monitoring, and hardware scaling. You can run Amazon RDS for Oracle under two different licensing models ñ ìLicense Includedî and ìBring-Your-Own-License (BYOL)î. In the ""License Included"" service model, you do not need separately purchased Oracle licenses; the Oracle Database software has been licensed by AWS.</p> "
RDS - MySQL,trial,platforms,FALSE,"<p>With Amazon RDS, you can deploy scalable MySQL servers in minutes with cost-efficient and resizable hardware capacity. Amazon RDS for MySQL frees you up to focus on application development by managing time-consuming database administration tasks including backups, software patching, monitoring, scaling and replication. Amazon RDS supports MySQL Community Edition versions 5.6, 5.7, and 8.0 which means that the code, applications, and tools you already use today can be used with Amazon RDS</p> "
RDS - Postgres,trial,platforms,FALSE,"<p>PostgreSQL has become the preferred open source relational database for many enterprise developers and start-ups, powering leading business and mobile applications. Amazon RDS makes it easy to set up, operate, and scale PostgreSQL deployments in the cloud. With Amazon RDS, you can deploy scalable PostgreSQL deployments in minutes with cost-efficient and resizable hardware capacity. Amazon RDS manages complex and time-consuming administrative tasks such as PostgreSQL software installation and upgrades; storage management; replication for high availability and read throughput; and backups for disaster recovery.</p> "
Amazon Aurora,trial,platforms,FALSE,"<p><b>Amazon Aurora</b> is a MySQL and PostgreSQL-compatible relational database built for the cloud, that combines the performance and availability of traditional enterprise databases with the simplicity and cost-effectiveness of open source databases.<br>Know more <a href=""https://aws.amazon.com/rds/aurora/?nc1=h_ls&aurora-whats-new.sort-by=item.additionalFields.postDateTime&aurora-whats-new.sort-order=desc"">here</a> </p>"
Mongo DB,trial,platforms,FALSE,"<p>MongoDB is a document database, which means it stores data in JSON-like documents. We believe this is the most natural way to think about data, and is much more expressive and powerful than the traditional row/column model.<br> MongoDB is a true data platform with a comprehensive suite of tools to make working with data remarkably easy for everyone, from developers to analysts to data scientists.<br >Know more <a href=""https://docs.mongodb.com/manual/"">here</a> </p>"
Datical DB,assess,platforms,FALSE,<p>Datical DB for SQL database improves and simplifies the application release process by automating database management.</p>
Kinesis,assess,platforms,FALSE,"<p> Amazon Kinesis makes it easy to collect, process, and analyze real-time, streaming data so you can get timely insights and react quickly to new information. Amazon Kinesis enables you to process and analyze data as it arrives and respond instantly instead of having to wait until all your data is collected before the processing can begin.  </p> "
AWS IoT Core,trial,platforms,FALSE,"<p> AWS IoT Core lets you connect IoT devices to the AWS cloud without the need to provision or manage servers. AWS IoT Core can support billions of devices and trillions of messages, and can process and route those messages to AWS endpoints and to other devices reliably and securely. With AWS IoT Core, your applications can keep track of and communicate with all your devices, all the time, even when they aren't connected </p> "
DocumentDB,trial,platforms,FALSE,"<p> Amazon DocumentDB (with MongoDB compatibility) is a fast, scalable, highly available, and fully managed document database service that supports MongoDB workloads. As a document database, Amazon DocumentDB makes it easy to store, query, and index JSON data </p> "
QLDB,trial,platforms,FALSE,"<p>  Amazon Quantum Ledger Database (Amazon QLDB) is a fully managed ledger database that provides a transparent, immutable, and cryptographically verifiable transaction log owned by a central trusted authority. You can use Amazon QLDB to track all application data changes, and maintain a complete and verifiable history of changes over time.</p>  "
ElastiCache (Memcached),trial,platforms,FALSE,"<p>Amazon ElastiCache offers fully managed Redis and Memcached. Seamlessly deploy, run, and scale popular open source compatible in-memory data stores. Build data-intensive apps or improve the performance of your existing apps by retrieving data from high throughput and low latency in-memory data stores</p> "
