name,ring,quadrant,isNew,description 
Amazon MQ (Active MQ),trial,platforms,FALSE,"<p> Amazon MQ is a managed message broker service for Apache ActiveMQ and RabbitMQ that makes it easy to set up and operate message brokers on AWS. Amazon MQ reduces your operational responsibilities by managing the provisioning, setup, and maintenance of message brokers for you. Because Amazon MQ connects to your current applications with industry-standard APIs and protocols, you can easily migrate to AWS without having to rewrite code. </p> "
EC2,assess,platforms,FALSE,"<p> Amazon Elastic Compute Cloud (Amazon EC2) is a web service that provides secure, resizable compute capacity in the cloud. It is designed to make web-scale cloud computing easier for developers. Amazon EC2's simple web service interface allows you to obtain and configure capacity with minimal friction. It provides you with complete control of your computing resources and lets you run on Amazon's proven computing environment </p> "
API Gateway,trial,platforms,FALSE,"<p> Amazon API Gateway is a fully managed service that makes it easy for developers to create, publish, maintain, monitor, and secure APIs at any scale. APIs act as the ""front door"" for applications to access data, business logic, or functionality from your backend services. Using API Gateway, you can create RESTful APIs and WebSocket APIs that enable real-time two-way communication applications. API Gateway supports containerized and serverless workloads, as well as web applications </p> "
SQS/SNS,assess,platforms,FALSE,"<p> Amazon Simple Queue Service (SQS) is a fully managed message queuing service that enables you to decouple and scale microservices, distributed systems, and serverless applications.  The A2A pub/sub functionality provides topics for high-throughput, push-based, many-to-many messaging between distributed systems, microservices, and event-driven serverless applications. Using Amazon SNS topics, your publisher systems can fanout messages to a large number of subscriber systems </p> "
Amazon Athena,assess,platforms,FALSE,"<p> Amazon Athena is an interactive query service that makes it easy to analyze data in Amazon S3 using standard SQL. Athena is serverless, so there is no infrastructure to manage, and you pay only for the queries that you run </p> "
QuickSight,assess,platforms,FALSE,"<p> Amazon QuickSight is a scalable, serverless, embeddable, machine learning-powered business intelligence (BI) service built for the cloud. QuickSight lets you easily create and publish interactive BI dashboards that include Machine Learning-powered insights. QuickSight dashboards can be accessed from any device, and seamlessly embedded into your applications, portals, and websites. </p> "
Amazon MQ (RabbitMQ),assess,platforms,FALSE,"<p> Amazon MQ is a managed message broker service for Apache ActiveMQ and RabbitMQ that makes it easy to set up and operate message brokers on AWS. Amazon MQ reduces your operational responsibilities by managing the provisioning, setup, and maintenance of message brokers for you. Because Amazon MQ connects to your current applications with industry-standard APIs and protocols, you can easily migrate to AWS without having to rewrite code. </p> "
Cloudwatch,assess,platforms,FALSE,"<p> Amazon CloudWatch is a monitoring and observability service built for DevOps engineers, developers, site reliability engineers (SREs), and IT managers. CloudWatch provides you with data and actionable insights to monitor your applications, respond to system-wide performance changes, optimize resource utilization, and get a unified view of operational health. CloudWatch collects monitoring and operational data in the form of logs, metrics, and events, providing you with a unified view of AWS resources, applications, and services that run on AWS and on-premises servers</p> "
WAF,assess,platforms,FALSE,"<p> AWS WAF is a web application firewall that helps protect your web applications or APIs against common web exploits that may affect availability, compromise security, or consume excessive resources. AWS WAF gives you control over how traffic reaches your applications by enabling you to create security rules that block common attack patterns, such as SQL injection or cross-site scripting, and rules that filter out specific traffic patterns you define </p> "
Starc,assess,platforms,FALSE,"<p> STARC Simulation and Testing Cloud ñ SSTC, allows engineers to test, validate, and optimize product/software designs via a high-availability real-time cloud platform</p> "
DynamoDB,assess,platforms,FALSE,"<p>Amazon DynamoDB is a fully managed proprietary NoSQL database service that supports key-value and document data structures and is offered by Amazon.com as part of the Amazon Web Services portfolio. DynamoDB exposes a similar data model to and derives its name from Dynamo, but has a different underlying implementation. Dynamo had a multi-master design requiring the client to resolve version conflicts and DynamoDB uses synchronous replication across multiple data centers for high durability and availability. </p> "
ElastiCache (Redis),assess,platforms,FALSE,"<p>Amazon ElastiCache offers fully managed Redis and Memcached. Seamlessly deploy, run, and scale popular open source compatible in-memory data stores. Build data-intensive apps or improve the performance of your existing apps by retrieving data from high throughput and low latency in-memory data stores</p> "
Secrets Manager AWS,adopt,platforms,FALSE,"<p>AWS Secrets Manager helps you protect secrets needed to access your applications, services, and IT resources. The service enables you to easily rotate, manage, and retrieve database credentials, API keys, and other secrets throughout their lifecycle. Users and applications retrieve secrets with a call to Secrets Manager APIs, eliminating the need to hardcode sensitive information in plain text. </p> "
ELB - ALB,adopt,platforms,FALSE,<p>Elastic Load Balancing (ELB) is a load-balancing service for Amazon Web Services (AWS) deployments. ELB automatically distributes incoming application traffic and scales resources to meet traffic demands</p> 
EKS,adopt,platforms,FALSE,"<p>Amazon Elastic Kubernetes Service (Amazon EKS) makes it easy to deploy, manage, and scale containerized applications using Kubernetes on AWS. Amazon EKS runs the Kubernetes management infrastructure for you across multiple AWS availability zones to eliminate a single point of failure</p> "
S3,adopt,platforms,FALSE,"<p>Amazon S3 or Amazon Simple Storage Service is a service offered by Amazon Web Services (AWS) that provides object storage through a web service interface. Amazon S3 uses the same scalable storage infrastructure that Amazon.com uses to run its global e-commerce network. Amazon S3 can be employed to store any type of object which allows for uses like storage for Internet applications, backup and recovery, disaster recovery, data archives, data lakes for analytics, and hybrid cloud storage  In its service-level agreement</p> "
CloudFront,adopt,platforms,FALSE,"<p>Amazon CloudFront is a content delivery network (CDN) offered by Amazon Web Services. Content delivery networks provide a globally-distributed network of proxy servers which cache content, such as web videos or other bulky media, more locally to consumers, thus improving access speed for downloading the content</p> "
API Connect,adopt,platforms,FALSE,"<p>IBM API Management(with version 5 renamed to IBM API Connect) is an API Management platform for use in the API Economy. IBM API Connect enables users to create, assemble, manage, secure and socialize web application programming interfaces (APIs).It provides a developer portal for application developers and to view published APIs. An administration portal allows users to establish policies for APIs such as self-registration, quotas, key management and security policies. An analytics engine provides role-based analytics for API owners, solution administrators and application developers in order to manage APIs and ensure service levels are being achieved</p> "
AADP,adopt,platforms,FALSE,"<p>Microsoft Azure Active Directory is a comprehensive identity and access management cloud solution that combines core directory services, application access management, and advanced identity protection</p> "
Docker,adopt,platforms,FALSE,"<p>Docker is a tool designed to make it easier to create, deploy, and run applications by using containers. Containers allow a developer to package up an application with all of the parts it needs, such as libraries and other dependencies, and ship it all out as one package. By doing so, thanks to the container, the developer can rest assured that the application will run on any other Linux machine regardless of any customized settings that machine might have that could differ from the machine used for writing and testing the code.</p> "
Azure DevOps,adopt,platforms,FALSE,<p> Azure DevOps is the evolution of VSTS (Visual Studio Team Services). It is the result of years of using their own tools and developing a process for building and delivering products in an efficient and effective way. </p> 
Dynatrace,adopt,platforms,FALSE,"<p>Dynatrace is a software intelligence company providing application performance management (APM), artificial intelligence for operations (AIOps), cloud infrastructure monitoring, and digital experience management (DEM), with products for the information technology departments and digital business owners of medium and large businesses</p> "
Istio,adopt,platforms,FALSE,"<p><strong><a href=""https://istio.io/"">Istio</a></strong> is becoming the  factor of  infrastructure to operationalize a <a href=""https://martinfowler.com/articles/microservices.html"">microservices</a> ecosystem. Its out-of-the-box implementation of cross-cutting concerns ‚Äî such as service discovery, service-to-service and origin-to-service security, observability (including telemetry and distributed tracing), rolling releases and resiliency ‚Äî has been bootstrapping our microservices implementations very quickly. It's the main implementation of the <a href=""/radar/techniques/service-mesh"">service mesh</a> technique we've been using. We've been enjoying its monthly releases and its continuous improvements with seamless upgrades. We use Istio to bootstrap our projects, starting with observability (tracing and telemetry) and service-to-service security. We're closely watching its improvements to service-to-service authentication everywhere in and outside of the mesh. We'd also like to see Istio establish best practices for configuration files to strike a balance between giving autonomy to service developers and control to the service mesh operators.</p> "
Kobiton,assess,platforms,FALSE,"<p><b>Kobiton</b> is a mobile device testing platform that accelerates the testing and delivery of mobile applications by offering live device testing in the cloud, or on-premise.<br> Know more <a href=""https://kobiton.com"">here</a> </p>"
Artifactory,adopt,platforms,FALSE,"<p><b>JFrog Artifactory</b> is a universal DevOps solution providing end-to-end automation and management of binaries and artifacts through the application delivery process that improves productivity across your development ecosystem. It enables freedom of choice supporting 25+ software build packages, all major CI/CD platforms, and DevOps tools you already use. Artifactory is Kubernetes ready supporting containers, Docker, Helm Charts, and is your Kubernetes and Docker registry and comes with full CLI and REST APIs customizable to your ecosystem.<br>Know more <a href=""https://www.jfrog.com/confluence/display/JFROG/JFrog+Artifactory"">here</a> </p>"
Sonar,adopt,platforms,FALSE,"<p><b>SonarQube¬Æ</b> is an automatic code review tool to detect bugs, vulnerabilities, and code smells in your code. It can integrate with your existing workflow to enable continuous code inspection across your project branches and pull requests.<br> Know more <a href=""https://docs.sonarqube.org/latest/"">here</a> </p>"
Kiuwan,adopt,platforms,FALSE,"<p><b>Kiuwan</b> is an End-to-end application security platform for every stage and all the stakeholders in the SDLC. OWASP, CWE, PCI-DSS, NIST. It is useful as Security Solutions for DevOps Process, giving an Effective static application security testing and software composition analysis. Also, it is an affordable solutions for teams of all sizes.<br >Know more <a href=""https://www.kiuwan.com"">here</a> </p>"
OpenShift,trial,platforms,FALSE,"<p><b>OpenShift</b> is a Kubernetes superset combining over 200 open source projects into a fully integrated solution with strong focus on a developer experience, operational capabilities, monitoring, and management with strong and secure defaults. All these while being pluggable so platform admins can replace out of the box components and services with their own.<br >Know more <a href=""https://www.openshift.com"">here</a> </p>"
AWS CodeDeploy,trial,platforms,FALSE,"<p><b>AWS CodeDeploy</b> is a fully managed deployment service that automates software deployments to a variety of compute services such as Amazon EC2, AWS Fargate, AWS Lambda, and your on-premises servers. AWS CodeDeploy makes it easier for you to rapidly release new features, helps you avoid downtime during application deployment, and handles the complexity of updating your applications. You can use AWS CodeDeploy to automate software deployments, eliminating the need for error-prone manual operations. The service scales to match your deployment needs.<br >Know more <a href=""https://www.openshift.com"">here</a> </p>"
HokeyApp,assess,platforms,FALSE,"<p><b>HockeyApp</b> is a service that allows developers to recruit and manage testers, distribute apps, and collect crash reports, among other things. It started out as a way to install beta apps on iOS devices, a process that Apple calls ‚Äúad hoc‚Äù distribution, or installing apps outside of the official App Store. From the words ad hoc, it was named Hockey. Currently, the project was retired.<br> Know more <a href=""https://devblogs.microsoft.com/appcenter/hockeyapp-is-being-retired/"">here</a> </p>"
Github,adopt,platforms,FALSE,"<p><b>GitHub</b> is a code hosting platform for version control and collaboration. It lets you and others work together on projects from anywhere. This tutorial teaches you GitHub essentials like repositories, branches, commits, and Pull Requests.<br> Know more <a href=""https://github.com"">here</a> </p>"
AWS Lambda,trial,platforms,FALSE,"<p><b>AWS Lambda</b> is a serverless compute service that runs your code in response to events and automatically manages the underlying compute resources for you. You can use AWS Lambda to extend other AWS services with custom logic, or create your own back-end services that operate at AWS scale, performance, and security. AWS Lambda can automatically run code in response to multiple events, such as HTTP requests via Amazon API Gateway, modifications to objects in Amazon S3 buckets, table updates in Amazon DynamoDB, and state transitions in AWS Step Functions.<br> Know more <a href=""https://github.com"">here</a> </p>"
Rational Team Concert,adopt,platforms,FALSE,"<p><b>Rational Team Concert‚Ñ¢</b> is a team collaboration tool that is built on a scalable, extensible platform. Rational Team Concert uses the Change and Configuration Management (CCM) application to provide features that integrate development project tasks including iteration planning, process definition, change management, defect tracking, source control, build automation, and reporting.<br> Know more <a href=""https://www.ibm.com/support/knowledgecenter/en/SSYMRC_6.0.0/com.ibm.team.concert.doc/topics/c_product-overview.html"">here</a> </p>"
Feature Flags Bancolombia,adopt,platforms,FALSE,"<p><b>Feature Flags or Feature Toogles </b>is a technique widely used by new architectures and deployment models that require the release of features in a fast and safe way for the user experience, allowing enabling or disabling features in production without the need to redeploy to all users or specific user segments, favors the practice of Trunk Based Development, as well as hot variations of features on mobile devices where it is difficult to achieve an update of all users.<br> Know more <a href=""https://dev.azure.com/GrupoBancolombia/Vicepresidencia%20Servicios%20de%20Tecnolog√≠a/_wiki/wikis/Vicepresidencia%20Servicios%20de%20Tecnolog√≠a.wiki/6756/Cultura-Feature-Flags"">aqu√≠</a> </p>"
UrbanCode,adopt,platforms,FALSE,"<p><b>UrbanCode</b> is a build management, deployment automation and release management solutions that can enable continuous delivery for any combination of on-premises, cloud and mainframe applications by eliminating manual, error-prone processes. <br> Know more <a href=""https://www.ibm.com/cloud/urbancode"">here</a> </p> "
Fluid Asserts,hold,platforms,FALSE,"<p><a href=""https://fluidattacks.com/resources/doc/asserts/#:~:text=Fluid%20Asserts%20is%20an%20engine,of%20many%20protocols%20(DXST)."">Fluid Asserts</a> is an engine to automate the closing of security findings over execution environments. Asserts performs Dynamic and Static Application Security Testing (DAST and SAST) and dynamic testing of many protocols (DXST). <br>Asserts reuses previously handcrafted attack vectors in order to automate the closing of vulnerabilities. This makes it particularly useful since this testing can be performed by end users as-is or as part of a continuous integration pipeline. Thus any changes to the Target of Evaluation (ToE) can be continuously tested against the closing of confirmed vulnerabilities.<br> </p>"
Kafka Streams,trial,platforms,FALSE,"<p><strong><a href=""https://kafka.apache.org/documentation/streams/"">Kafka Streams</a></strong> is a lightweight library to build streaming applications. It supports basic streaming APIs such as join, filter, map and aggregate as well as local storage for common use cases such as windowing and sessions. Unlike other stream-processing platforms such as <a href=""/radar/platforms/apache-spark"">Apache Spark</a> and <a href=""https://doc.akka.io/docs/akka-stream-kafka/current/home.html"">Alpakka Kafka</a>, Kafka Streams has been a good fit for scenarios that don't require large-scale distribution and parallel processing; hence we could get away without yet another piece of infrastructure such as cluster schedulers. Naturally, Kafka Streams has been a good choice when operating in the Kafka ecosystem. Kafka Streams is particularly useful when we have to process data strictly in order and exactly once. One particular use case of Kafka Streams is to build a <a href=""https://en.wikipedia.org/wiki/Change_data_capture#Event_Programming"">change data capture (CDC)</a> platform.</p> "
Microfrontends,assess,techniques,FALSE,"<p>We've seen significant benefits from introducing <a href=""https://martinfowler.com/articles/microservices.html"">microservices</a>, which have allowed teams to scale the delivery of independently deployed and maintained services. Unfortunately, we've also seen many teams create a frontend monolith ‚Äî a large, entangled browser application that sits on top of the backend services ‚Äî largely neutralizing the benefits of microservices. Since we first described <strong>micro frontends</strong> as a technique to address this issue, we've had almost universally positive experiences with the approach and have found a number of patterns to use micro frontends even as more and more code shifts from the server to the web browser. So far, <a href=""/radar/platforms/web-components-standard"">web components</a> have been elusive in this field, though.</p> "
Secrets as a service,adopt,techniques,FALSE,"<p>Humans and machines use secrets throughout the value stream of building and operating software. The build pipelines need secrets to interface with secure infrastructures such as container registries, the applications use API keys as secrets to get access to business capabilities, and the service-to-service communications are secured using certificates and keys as secrets. You can set and retrieve these secrets in different ways. We've long cautioned developers about using source code management for storing secrets. We've recommended <a href=""/radar/techniques/decoupling-secret-management-from-source-code"">decoupling secret management from source code</a> and using tools such as <a href=""/radar/tools/git-secrets"">git-secrets</a> and <a href=""/radar/tools/talisman"">Talisman</a> to avoid storing secrets in the source code. We've been using <strong>secrets as a service</strong> as a default technique for storing and accessing secrets. With this technique you can use tools such as <a href=""/radar/tools/hashicorp-vault"">Vault</a> or <a href=""https://aws.amazon.com/kms/"">AWS Key Management Service (KMS)</a> to read/write secrets over an HTTPS endpoint with fine-grained levels of access control. Secrets as a service uses external identity providers such as <a href=""https://aws.amazon.com/iam/"">AWS IAM</a> to identify the actors who request access to secrets. Actors authenticate themselves with the secrets service. For this process to work, it's important to automate bootstrapping the identity of the actors, services and applications. Platforms based on <a href=""/radar/platforms/spiffe"">SPIFFE</a> have improved the automation of assigning identities to services.</p> "
Chaos Engineering,adopt,techniques,TRUE,"<p>In the last year we have seen <strong>Chaos Engineering</strong> go from being a much talked about idea to an accepted, widely accepted idea to improve and ensure the resiliency of distributed systems. As organizations large and small begin to implement Chaos Engineering as an operational process, we are learning how to safely apply these techniques on a large scale. The approach is definitely not for everyone and to be effective and secure requires large-scale organizational support. Industry acceptance and availability of experts will definitely increase with the advent of commercial services such as <a href=""/radar/tools/gremlin"">Gremlin</a>and deployment tools such as <a href=""/radar/tools/spinnaker"">Spinnaker</a> implementing some Chaos Engineering tools. Check <a href=""https://dev.azure.com/GrupoBancolombia/Vicepresidencia%20Servicios%20de%20Tecnolog√≠a/_wiki/wikis/Vicepresidencia%20Servicios%20de%20Tecnolog√≠a.wiki/12088/Continuous-Chaos"">here≠</a> regarding Chaos Engineering in Bancolombia.</p> "
Container security scanning,adopt,techniques,FALSE,"<p>The container revolution around <a href=""/radar/platforms/docker"">Docker</a> has massively reduced the friction in moving applications between environments, fueling increased adoption of continuous delivery and continuous deployments. The latter, especially, has blown a rather large hole in the traditional controls over what can go to production. The technique of <strong>container security scanning</strong> is a necessary response to this threat vector. Tools in the build pipeline automatically check containers flowing through the pipeline against known vulnerabilities. Since our first mention of this technique, the tool landscape has matured and the technique has proven useful on development efforts with our clients.</p> "
Service mesh,assess,techniques,FALSE,"<p><strong>Service mesh</strong> is an approach to operating a secure, fast and reliable microservices ecosystem. It has been an important stepping stone in making it easier to adopt microservices at scale. It offers discovery, security, tracing, monitoring and failure handling. It provides these cross-functional capabilities without the need for a shared asset such as an API gateway or baking libraries into each service. A typical implementation involves lightweight reverse-proxy processes, aka sidecars, deployed alongside each service process in a separate container. Sidecars intercept the inbound and outbound traffic of each service and provide cross-functional capabilities mentioned above. This approach has relieved the distributed service teams from building and updating the capabilities that the mesh offers as code in their services. This has lead to an even easier adoption of <a href=""/radar/techniques/polyglot-programming"">polyglot programming</a> in a microservices ecosystem. Our teams have been successfully using this approach with open source projects such as <a href=""/radar/platforms/istio"">Istio</a> and we will continue to monitor other open service mesh implementations such as <a href=""http://linkerd.io/"">Linkerd</a> closely.</p> "
